{
  "identifiers": {
    "borrower_name": "Harbour Point Logistics Ltd",
    "facility_name": "Incremental Term Loan A",
    "facility_id": "LN964559",
    "tranche_name": "Term B-2",
    "cusip": "EGXAF3VVA",
    "lin": "LX7887734",
    "currency": "GBP"
  },
  "notice_date": "2026-06-22",
  "events": [
    {
      "type": "rollover",
      "dates": {
        "effective_date": "2026-06-30",
        "period_start": "2026-06-30",
        "period_end": "2026-09-26",
        "payment_due_date": null,
        "rate_set_date": null
      },
      "economics": {
        "base_rate_index": "SONIA",
        "base_rate": 0.043441,
        "margin": 0.011927,
        "all_in_rate": 0.055368,
        "day_count_convention": "Actual/365",
        "days_in_period": null,
        "outstanding_principal_before": null,
        "principal_amount": null,
        "outstanding_principal_after": null,
        "accrued_interest": null,
        "fee_amount": null,
        "fee_type": null,
        "drawdown_amount": null,
        "commitment_reduction_amount": null,
        "unfunded_commitment": null,
        "lender_share_amount": null,
        "global_amount": 13000000
      },
      "warnings": []
    }
  ],
  "field_confidence": {},
  "warnings": []
}