{
  "identifiers": {
    "borrower_name": "Ashcroft Materials Company",
    "facility_name": "Delayed Draw Term Loan",
    "facility_id": "LN917876",
    "tranche_name": "DDTL-2",
    "cusip": null,
    "lin": null,
    "currency": "EUR"
  },
  "notice_date": "2026-01-13",
  "events": [
    {
      "type": "principal_payment",
      "dates": {
        "effective_date": "2026-01-30",
        "period_start": null,
        "period_end": null,
        "payment_due_date": "2026-01-30",
        "rate_set_date": null
      },
      "economics": {
        "base_rate_index": null,
        "base_rate": null,
        "margin": null,
        "all_in_rate": null,
        "day_count_convention": null,
        "days_in_period": null,
        "outstanding_principal_before": 59000000,
        "principal_amount": 1514130.76,
        "outstanding_principal_after": 57485869.24,
        "accrued_interest": null,
        "fee_amount": null,
        "fee_type": null,
        "drawdown_amount": null,
        "commitment_reduction_amount": null,
        "unfunded_commitment": null,
        "lender_share_amount": null,
        "global_amount": null
      },
      "warnings": []
    },
    {
      "type": "rate_reset",
      "dates": {
        "effective_date": "2026-01-30",
        "period_start": "2026-01-30",
        "period_end": "2026-04-17",
        "payment_due_date": null,
        "rate_set_date": "2026-01-13"
      },
      "economics": {
        "base_rate_index": "EURIBOR",
        "base_rate": 0.048065,
        "margin": 0.023652,
        "all_in_rate": 0.071717,
        "day_count_convention": "Actual/360",
        "days_in_period": null,
        "outstanding_principal_before": null,
        "principal_amount": null,
        "outstanding_principal_after": null,
        "accrued_interest": null,
        "fee_amount": null,
        "fee_type": null,
        "drawdown_amount": null,
        "commitment_reduction_amount": null,
        "unfunded_commitment": null,
        "lender_share_amount": null,
        "global_amount": null
      },
      "warnings": []
    }
  ],
  "field_confidence": {},
  "warnings": []
}