{
  "identifiers": {
    "borrower_name": "ACCO Brands Corporation",
    "facility_name": "Multicurrency Revolving Facility",
    "facility_id": "LN911672",
    "tranche_name": "Revolver B",
    "cusip": null,
    "lin": null,
    "currency": "EUR"
  },
  "notice_date": "2026-02-28",
  "events": [
    {
      "type": "principal_payment",
      "dates": {
        "effective_date": "2026-03-06",
        "period_start": null,
        "period_end": null,
        "payment_due_date": "2026-03-06",
        "rate_set_date": null
      },
      "economics": {
        "base_rate_index": null,
        "base_rate": null,
        "margin": null,
        "all_in_rate": null,
        "day_count_convention": null,
        "days_in_period": null,
        "outstanding_principal_before": 126000000,
        "principal_amount": 8693156.15,
        "outstanding_principal_after": 117306843.85,
        "accrued_interest": null,
        "fee_amount": null,
        "fee_type": null,
        "drawdown_amount": null,
        "commitment_reduction_amount": null,
        "unfunded_commitment": null,
        "lender_share_amount": null,
        "global_amount": null
      },
      "warnings": []
    }
  ],
  "field_confidence": {},
  "warnings": []
}