{
  "identifiers": {
    "borrower_name": "Northstar Packaging Inc",
    "facility_name": "Incremental Term Loan A",
    "facility_id": "LN543628",
    "tranche_name": "Term B-1",
    "cusip": null,
    "lin": null,
    "currency": "USD"
  },
  "notice_date": "2026-02-15",
  "events": [
    {
      "type": "principal_payment",
      "dates": {
        "effective_date": "2026-03-01",
        "period_start": null,
        "period_end": null,
        "payment_due_date": "2026-03-01",
        "rate_set_date": null
      },
      "economics": {
        "base_rate_index": null,
        "base_rate": null,
        "margin": null,
        "all_in_rate": null,
        "day_count_convention": null,
        "days_in_period": null,
        "outstanding_principal_before": 141000000,
        "principal_amount": 3141172.21,
        "outstanding_principal_after": 137858827.79,
        "accrued_interest": null,
        "fee_amount": null,
        "fee_type": null,
        "drawdown_amount": null,
        "commitment_reduction_amount": null,
        "unfunded_commitment": null,
        "lender_share_amount": null,
        "global_amount": null
      },
      "warnings": []
    },
    {
      "type": "rate_reset",
      "dates": {
        "effective_date": "2026-03-01",
        "period_start": "2026-03-01",
        "period_end": "2026-04-28",
        "payment_due_date": null,
        "rate_set_date": "2026-02-15"
      },
      "economics": {
        "base_rate_index": "Term SOFR",
        "base_rate": 0.028342,
        "margin": 0.02003,
        "all_in_rate": 0.048372,
        "day_count_convention": "30/360",
        "days_in_period": null,
        "outstanding_principal_before": null,
        "principal_amount": null,
        "outstanding_principal_after": null,
        "accrued_interest": null,
        "fee_amount": null,
        "fee_type": null,
        "drawdown_amount": null,
        "commitment_reduction_amount": null,
        "unfunded_commitment": null,
        "lender_share_amount": null,
        "global_amount": null
      },
      "warnings": []
    }
  ],
  "field_confidence": {},
  "warnings": []
}