{
  "identifiers": {
    "borrower_name": "Pemberton Specialty Chemicals",
    "facility_name": "Incremental Term Loan A",
    "facility_id": "LN289791",
    "tranche_name": "Term B-1",
    "cusip": "WSY96Z9RU",
    "lin": "LX7166783",
    "currency": "USD"
  },
  "notice_date": "2026-02-26",
  "events": [
    {
      "type": "fee",
      "dates": {
        "effective_date": "2026-03-11",
        "period_start": null,
        "period_end": null,
        "payment_due_date": "2026-03-11",
        "rate_set_date": null
      },
      "economics": {
        "base_rate_index": null,
        "base_rate": null,
        "margin": null,
        "all_in_rate": null,
        "day_count_convention": null,
        "days_in_period": null,
        "outstanding_principal_before": null,
        "principal_amount": null,
        "outstanding_principal_after": null,
        "accrued_interest": null,
        "fee_amount": 368982.72,
        "fee_type": "Upfront Fee",
        "drawdown_amount": null,
        "commitment_reduction_amount": null,
        "unfunded_commitment": 11000000,
        "lender_share_amount": null,
        "global_amount": null
      },
      "warnings": []
    }
  ],
  "field_confidence": {},
  "warnings": []
}