{
  "identifiers": {
    "borrower_name": "Pemberton Specialty Chemicals",
    "facility_name": "Multicurrency Revolving Facility",
    "facility_id": "LN797860",
    "tranche_name": "Revolver A",
    "cusip": "9Z0JNUMMH",
    "lin": "LX6614441",
    "currency": "GBP"
  },
  "notice_date": "2026-06-29",
  "events": [
    {
      "type": "rollover",
      "dates": {
        "effective_date": "2026-07-04",
        "period_start": "2026-07-04",
        "period_end": "2026-11-09",
        "payment_due_date": null,
        "rate_set_date": null
      },
      "economics": {
        "base_rate_index": "SONIA",
        "base_rate": 0.055964,
        "margin": 0.027724,
        "all_in_rate": 0.083688,
        "day_count_convention": "Actual/365",
        "days_in_period": null,
        "outstanding_principal_before": null,
        "principal_amount": null,
        "outstanding_principal_after": null,
        "accrued_interest": null,
        "fee_amount": null,
        "fee_type": null,
        "drawdown_amount": null,
        "commitment_reduction_amount": null,
        "unfunded_commitment": null,
        "lender_share_amount": null,
        "global_amount": 117000000
      },
      "warnings": []
    }
  ],
  "field_confidence": {},
  "warnings": []
}