{
  "identifiers": {
    "borrower_name": "ACCO Brands Corporation",
    "facility_name": "Multicurrency Revolving Facility",
    "facility_id": "LN449166",
    "tranche_name": "Revolver B",
    "cusip": "N87ZRGHL3",
    "lin": null,
    "currency": "USD"
  },
  "notice_date": "2026-05-14",
  "events": [
    {
      "type": "rate_reset",
      "dates": {
        "effective_date": "2026-05-28",
        "period_start": "2026-05-28",
        "period_end": "2026-08-02",
        "payment_due_date": null,
        "rate_set_date": "2026-05-14"
      },
      "economics": {
        "base_rate_index": "Prime Rate",
        "base_rate": 0.039981,
        "margin": 0.034633,
        "all_in_rate": null,
        "day_count_convention": "30/360",
        "days_in_period": null,
        "outstanding_principal_before": null,
        "principal_amount": null,
        "outstanding_principal_after": null,
        "accrued_interest": null,
        "fee_amount": null,
        "fee_type": null,
        "drawdown_amount": null,
        "commitment_reduction_amount": null,
        "unfunded_commitment": null,
        "lender_share_amount": null,
        "global_amount": null
      },
      "warnings": []
    }
  ],
  "field_confidence": {},
  "warnings": []
}