{
  "identifiers": {
    "borrower_name": "Ashcroft Materials Company",
    "facility_name": "Revolving Credit Facility",
    "facility_id": "LN678339",
    "tranche_name": null,
    "cusip": "ZVBRRZTB3",
    "lin": "LX4245459",
    "currency": "EUR"
  },
  "notice_date": "2026-02-22",
  "events": [
    {
      "type": "rollover",
      "dates": {
        "effective_date": "2026-02-24",
        "period_start": "2026-02-24",
        "period_end": "2026-04-04",
        "payment_due_date": null,
        "rate_set_date": null
      },
      "economics": {
        "base_rate_index": "EURIBOR",
        "base_rate": 0.048935,
        "margin": 0.039339,
        "all_in_rate": 0.088274,
        "day_count_convention": "Actual/360",
        "days_in_period": null,
        "outstanding_principal_before": null,
        "principal_amount": null,
        "outstanding_principal_after": null,
        "accrued_interest": null,
        "fee_amount": null,
        "fee_type": null,
        "drawdown_amount": null,
        "commitment_reduction_amount": null,
        "unfunded_commitment": null,
        "lender_share_amount": null,
        "global_amount": 123000000
      },
      "warnings": []
    }
  ],
  "field_confidence": {},
  "warnings": []
}