{
  "identifiers": {
    "borrower_name": "Pemberton Specialty Chemicals",
    "facility_name": "Revolving Credit Facility",
    "facility_id": "LN791330",
    "tranche_name": "Revolver A",
    "cusip": "CC982CBPG",
    "lin": null,
    "currency": "EUR"
  },
  "notice_date": "2026-07-18",
  "events": [
    {
      "type": "drawdown",
      "dates": {
        "effective_date": "2026-07-26",
        "period_start": null,
        "period_end": null,
        "payment_due_date": null,
        "rate_set_date": null
      },
      "economics": {
        "base_rate_index": null,
        "base_rate": null,
        "margin": null,
        "all_in_rate": null,
        "day_count_convention": null,
        "days_in_period": null,
        "outstanding_principal_before": null,
        "principal_amount": null,
        "outstanding_principal_after": null,
        "accrued_interest": null,
        "fee_amount": null,
        "fee_type": null,
        "drawdown_amount": 84292010.34,
        "commitment_reduction_amount": null,
        "unfunded_commitment": null,
        "lender_share_amount": 10536501.29,
        "global_amount": 84292010.34
      },
      "warnings": []
    },
    {
      "type": "commitment_reduction",
      "dates": {
        "effective_date": "2026-07-26",
        "period_start": null,
        "period_end": null,
        "payment_due_date": null,
        "rate_set_date": null
      },
      "economics": {
        "base_rate_index": null,
        "base_rate": null,
        "margin": null,
        "all_in_rate": null,
        "day_count_convention": null,
        "days_in_period": null,
        "outstanding_principal_before": null,
        "principal_amount": null,
        "outstanding_principal_after": null,
        "accrued_interest": null,
        "fee_amount": null,
        "fee_type": null,
        "drawdown_amount": null,
        "commitment_reduction_amount": 15000000,
        "unfunded_commitment": 157707989.66,
        "lender_share_amount": null,
        "global_amount": null
      },
      "warnings": []
    }
  ],
  "field_confidence": {},
  "warnings": []
}