{
  "identifiers": {
    "borrower_name": "Alderwood Media Holdings",
    "facility_name": "Revolving Credit Facility",
    "facility_id": "LN827281",
    "tranche_name": "Revolver A",
    "cusip": null,
    "lin": null,
    "currency": "USD"
  },
  "notice_date": "2026-07-24",
  "events": [
    {
      "type": "principal_payment",
      "dates": {
        "effective_date": "2026-08-04",
        "period_start": null,
        "period_end": null,
        "payment_due_date": "2026-08-04",
        "rate_set_date": null
      },
      "economics": {
        "base_rate_index": null,
        "base_rate": null,
        "margin": null,
        "all_in_rate": null,
        "day_count_convention": null,
        "days_in_period": null,
        "outstanding_principal_before": 28000000,
        "principal_amount": 3129899.21,
        "outstanding_principal_after": 24870100.79,
        "accrued_interest": null,
        "fee_amount": null,
        "fee_type": null,
        "drawdown_amount": null,
        "commitment_reduction_amount": null,
        "unfunded_commitment": null,
        "lender_share_amount": null,
        "global_amount": null
      },
      "warnings": []
    }
  ],
  "field_confidence": {},
  "warnings": []
}