{
  "identifiers": {
    "borrower_name": "Calder Aerospace Holdings LLC",
    "facility_name": "Delayed Draw Term Loan",
    "facility_id": "LN477137",
    "tranche_name": "DDTL-2",
    "cusip": "R1ZLW2CWA",
    "lin": null,
    "currency": "USD"
  },
  "notice_date": "2026-06-22",
  "events": [
    {
      "type": "interest_payment",
      "dates": {
        "effective_date": null,
        "period_start": "2026-03-26",
        "period_end": "2026-07-03",
        "payment_due_date": "2026-07-05",
        "rate_set_date": null
      },
      "economics": {
        "base_rate_index": "Prime Rate",
        "base_rate": 0.046499,
        "margin": 0.028363,
        "all_in_rate": 0.074862,
        "day_count_convention": "Actual/360",
        "days_in_period": 99,
        "outstanding_principal_before": 170000000,
        "principal_amount": null,
        "outstanding_principal_after": null,
        "accrued_interest": 3499798.50,
        "fee_amount": null,
        "fee_type": null,
        "drawdown_amount": null,
        "commitment_reduction_amount": null,
        "unfunded_commitment": null,
        "lender_share_amount": null,
        "global_amount": null
      },
      "warnings": []
    }
  ],
  "field_confidence": {},
  "warnings": []
}