{
  "identifiers": {
    "borrower_name": "Pemberton Specialty Chemicals",
    "facility_name": "Second Lien Term Facility",
    "facility_id": "LN645864",
    "tranche_name": "Term B-1",
    "cusip": "C8YJNZXK6",
    "lin": null,
    "currency": "EUR"
  },
  "notice_date": "2026-10-13",
  "events": [
    {
      "type": "rate_reset",
      "dates": {
        "effective_date": "2026-10-17",
        "period_start": "2026-10-17",
        "period_end": "2027-01-11",
        "payment_due_date": null,
        "rate_set_date": "2026-10-13"
      },
      "economics": {
        "base_rate_index": "EURIBOR",
        "base_rate": 0.04729,
        "margin": 0.013853,
        "all_in_rate": null,
        "day_count_convention": "Actual/360",
        "days_in_period": null,
        "outstanding_principal_before": null,
        "principal_amount": null,
        "outstanding_principal_after": null,
        "accrued_interest": null,
        "fee_amount": null,
        "fee_type": null,
        "drawdown_amount": null,
        "commitment_reduction_amount": null,
        "unfunded_commitment": null,
        "lender_share_amount": null,
        "global_amount": null
      },
      "warnings": []
    }
  ],
  "field_confidence": {},
  "warnings": []
}