{
  "identifiers": {
    "borrower_name": "Harbour Point Logistics Ltd",
    "facility_name": "Revolving Credit Facility",
    "facility_id": "LN435874",
    "tranche_name": null,
    "cusip": "K1489ERPD",
    "lin": null,
    "currency": "EUR"
  },
  "notice_date": "2026-10-20",
  "events": [
    {
      "type": "rate_reset",
      "dates": {
        "effective_date": "2026-10-23",
        "period_start": "2026-10-23",
        "period_end": "2026-12-14",
        "payment_due_date": null,
        "rate_set_date": "2026-10-20"
      },
      "economics": {
        "base_rate_index": "ESTR",
        "base_rate": 0.032792,
        "margin": 0.017498,
        "all_in_rate": 0.05029,
        "day_count_convention": "Actual/360",
        "days_in_period": null,
        "outstanding_principal_before": null,
        "principal_amount": null,
        "outstanding_principal_after": null,
        "accrued_interest": null,
        "fee_amount": null,
        "fee_type": null,
        "drawdown_amount": null,
        "commitment_reduction_amount": null,
        "unfunded_commitment": null,
        "lender_share_amount": null,
        "global_amount": null
      },
      "warnings": []
    }
  ],
  "field_confidence": {},
  "warnings": []
}