{
  "identifiers": {
    "borrower_name": "ACCO Brands Corporation",
    "facility_name": "Incremental Term Loan A",
    "facility_id": "LN579780",
    "tranche_name": null,
    "cusip": null,
    "lin": null,
    "currency": "EUR"
  },
  "notice_date": "2026-06-02",
  "events": [
    {
      "type": "interest_payment",
      "dates": {
        "effective_date": null,
        "period_start": "2026-05-02",
        "period_end": "2026-06-03",
        "payment_due_date": "2026-06-05",
        "rate_set_date": null
      },
      "economics": {
        "base_rate_index": "EURIBOR",
        "base_rate": 0.037875,
        "margin": 0.037355,
        "all_in_rate": 0.07523,
        "day_count_convention": "Actual/360",
        "days_in_period": 32,
        "outstanding_principal_before": 127000000,
        "principal_amount": null,
        "outstanding_principal_after": null,
        "accrued_interest": 849263.11,
        "fee_amount": null,
        "fee_type": null,
        "drawdown_amount": null,
        "commitment_reduction_amount": null,
        "unfunded_commitment": null,
        "lender_share_amount": null,
        "global_amount": null
      },
      "warnings": []
    }
  ],
  "field_confidence": {},
  "warnings": []
}