{
  "identifiers": {
    "borrower_name": "Bluestem Health Partners LP",
    "facility_name": "Senior Secured Term Loan B",
    "facility_id": "LN325599",
    "tranche_name": null,
    "cusip": "SS2KPV988",
    "lin": "LX8276207",
    "currency": "USD"
  },
  "notice_date": "2026-09-20",
  "events": [
    {
      "type": "principal_payment",
      "dates": {
        "effective_date": "2026-10-13",
        "period_start": null,
        "period_end": null,
        "payment_due_date": "2026-10-13",
        "rate_set_date": null
      },
      "economics": {
        "base_rate_index": null,
        "base_rate": null,
        "margin": null,
        "all_in_rate": null,
        "day_count_convention": null,
        "days_in_period": null,
        "outstanding_principal_before": 87000000,
        "principal_amount": 12333572.27,
        "outstanding_principal_after": 74666427.73,
        "accrued_interest": null,
        "fee_amount": null,
        "fee_type": null,
        "drawdown_amount": null,
        "commitment_reduction_amount": null,
        "unfunded_commitment": null,
        "lender_share_amount": null,
        "global_amount": null
      },
      "warnings": []
    }
  ],
  "field_confidence": {},
  "warnings": []
}