{
  "identifiers": {
    "borrower_name": "Alderwood Media Holdings",
    "facility_name": "Multicurrency Revolving Facility",
    "facility_id": "LN416301",
    "tranche_name": null,
    "cusip": null,
    "lin": "LX5268972",
    "currency": "USD"
  },
  "notice_date": "2026-09-17",
  "events": [
    {
      "type": "interest_payment",
      "dates": {
        "effective_date": null,
        "period_start": "2026-07-06",
        "period_end": "2026-09-27",
        "payment_due_date": "2026-09-29",
        "rate_set_date": null
      },
      "economics": {
        "base_rate_index": "Prime Rate",
        "base_rate": 0.02547,
        "margin": 0.017684,
        "all_in_rate": 0.043154,
        "day_count_convention": "30/360",
        "days_in_period": 83,
        "outstanding_principal_before": 24000000,
        "principal_amount": null,
        "outstanding_principal_after": null,
        "accrued_interest": 238785.47,
        "fee_amount": null,
        "fee_type": null,
        "drawdown_amount": null,
        "commitment_reduction_amount": null,
        "unfunded_commitment": null,
        "lender_share_amount": null,
        "global_amount": null
      },
      "warnings": []
    }
  ],
  "field_confidence": {},
  "warnings": []
}