{
  "identifiers": {
    "borrower_name": "Calder Aerospace Holdings LLC",
    "facility_name": "Incremental Term Loan A",
    "facility_id": "LN212347",
    "tranche_name": "Term A",
    "cusip": "3050UM6NP",
    "lin": null,
    "currency": "EUR"
  },
  "notice_date": "2026-02-28",
  "events": [
    {
      "type": "principal_payment",
      "dates": {
        "effective_date": "2026-03-25",
        "period_start": null,
        "period_end": null,
        "payment_due_date": "2026-03-25",
        "rate_set_date": null
      },
      "economics": {
        "base_rate_index": null,
        "base_rate": null,
        "margin": null,
        "all_in_rate": null,
        "day_count_convention": null,
        "days_in_period": null,
        "outstanding_principal_before": 178000000,
        "principal_amount": 5408157.64,
        "outstanding_principal_after": 172591842.36,
        "accrued_interest": null,
        "fee_amount": null,
        "fee_type": null,
        "drawdown_amount": null,
        "commitment_reduction_amount": null,
        "unfunded_commitment": null,
        "lender_share_amount": null,
        "global_amount": null
      },
      "warnings": []
    }
  ],
  "field_confidence": {},
  "warnings": []
}