{
  "identifiers": {
    "borrower_name": "Vantage Rail Services Inc",
    "facility_name": "Second Lien Term Facility",
    "facility_id": "LN792359",
    "tranche_name": null,
    "cusip": null,
    "lin": null,
    "currency": "EUR"
  },
  "notice_date": "2026-08-15",
  "events": [
    {
      "type": "fee",
      "dates": {
        "effective_date": "2026-08-31",
        "period_start": null,
        "period_end": null,
        "payment_due_date": "2026-08-31",
        "rate_set_date": null
      },
      "economics": {
        "base_rate_index": null,
        "base_rate": null,
        "margin": null,
        "all_in_rate": null,
        "day_count_convention": null,
        "days_in_period": null,
        "outstanding_principal_before": null,
        "principal_amount": null,
        "outstanding_principal_after": null,
        "accrued_interest": null,
        "fee_amount": 174870.78,
        "fee_type": "Amendment Fee",
        "drawdown_amount": null,
        "commitment_reduction_amount": null,
        "unfunded_commitment": 20000000,
        "lender_share_amount": null,
        "global_amount": null
      },
      "warnings": []
    }
  ],
  "field_confidence": {},
  "warnings": []
}