{
  "identifiers": {
    "borrower_name": "Harbour Point Logistics Ltd",
    "facility_name": "Senior Secured Term Loan B",
    "facility_id": "LN243892",
    "tranche_name": "Term B-2",
    "cusip": "GEH63ZD3Y",
    "lin": null,
    "currency": "USD"
  },
  "notice_date": "2026-03-20",
  "events": [
    {
      "type": "principal_payment",
      "dates": {
        "effective_date": "2026-03-25",
        "period_start": null,
        "period_end": null,
        "payment_due_date": "2026-03-25",
        "rate_set_date": null
      },
      "economics": {
        "base_rate_index": null,
        "base_rate": null,
        "margin": null,
        "all_in_rate": null,
        "day_count_convention": null,
        "days_in_period": null,
        "outstanding_principal_before": 100000000,
        "principal_amount": 6479195.83,
        "outstanding_principal_after": 93520804.17,
        "accrued_interest": null,
        "fee_amount": null,
        "fee_type": null,
        "drawdown_amount": null,
        "commitment_reduction_amount": null,
        "unfunded_commitment": null,
        "lender_share_amount": null,
        "global_amount": null
      },
      "warnings": []
    },
    {
      "type": "rate_reset",
      "dates": {
        "effective_date": "2026-03-25",
        "period_start": "2026-03-25",
        "period_end": "2026-05-28",
        "payment_due_date": null,
        "rate_set_date": "2026-03-20"
      },
      "economics": {
        "base_rate_index": "Prime Rate",
        "base_rate": 0.049902,
        "margin": 0.025502,
        "all_in_rate": 0.075404,
        "day_count_convention": "Actual/360",
        "days_in_period": null,
        "outstanding_principal_before": null,
        "principal_amount": null,
        "outstanding_principal_after": null,
        "accrued_interest": null,
        "fee_amount": null,
        "fee_type": null,
        "drawdown_amount": null,
        "commitment_reduction_amount": null,
        "unfunded_commitment": null,
        "lender_share_amount": null,
        "global_amount": null
      },
      "warnings": []
    }
  ],
  "field_confidence": {},
  "warnings": []
}