{
  "identifiers": {
    "borrower_name": "Bluestem Health Partners LP",
    "facility_name": "Delayed Draw Term Loan",
    "facility_id": "LN913361",
    "tranche_name": "DDTL-1",
    "cusip": null,
    "lin": null,
    "currency": "EUR"
  },
  "notice_date": "2026-03-28",
  "events": [
    {
      "type": "rate_reset",
      "dates": {
        "effective_date": "2026-04-07",
        "period_start": "2026-04-07",
        "period_end": "2026-06-28",
        "payment_due_date": null,
        "rate_set_date": "2026-03-28"
      },
      "economics": {
        "base_rate_index": "EURIBOR",
        "base_rate": 0.023626,
        "margin": 0.035636,
        "all_in_rate": 0.059262,
        "day_count_convention": "Actual/360",
        "days_in_period": null,
        "outstanding_principal_before": null,
        "principal_amount": null,
        "outstanding_principal_after": null,
        "accrued_interest": null,
        "fee_amount": null,
        "fee_type": null,
        "drawdown_amount": null,
        "commitment_reduction_amount": null,
        "unfunded_commitment": null,
        "lender_share_amount": null,
        "global_amount": null
      },
      "warnings": []
    }
  ],
  "field_confidence": {},
  "warnings": []
}