{
  "identifiers": {
    "borrower_name": "Kestrel Marine Terminals LLC",
    "facility_name": "Delayed Draw Term Loan",
    "facility_id": "LN556393",
    "tranche_name": null,
    "cusip": null,
    "lin": "LX7376713",
    "currency": "USD"
  },
  "notice_date": "2026-05-02",
  "events": [
    {
      "type": "fee",
      "dates": {
        "effective_date": "2026-05-20",
        "period_start": null,
        "period_end": null,
        "payment_due_date": "2026-05-20",
        "rate_set_date": null
      },
      "economics": {
        "base_rate_index": null,
        "base_rate": null,
        "margin": null,
        "all_in_rate": null,
        "day_count_convention": null,
        "days_in_period": null,
        "outstanding_principal_before": null,
        "principal_amount": null,
        "outstanding_principal_after": null,
        "accrued_interest": null,
        "fee_amount": 48803.51,
        "fee_type": "Commitment Fee",
        "drawdown_amount": null,
        "commitment_reduction_amount": null,
        "unfunded_commitment": null,
        "lender_share_amount": null,
        "global_amount": null
      },
      "warnings": []
    }
  ],
  "field_confidence": {},
  "warnings": []
}