{
  "identifiers": {
    "borrower_name": "Ashcroft Materials Company",
    "facility_name": "Senior Secured Term Loan B",
    "facility_id": "LN645126",
    "tranche_name": "Term B-2",
    "cusip": "P0D6LBSFQ",
    "lin": "LX6050402",
    "currency": "USD"
  },
  "notice_date": "2026-05-18",
  "events": [
    {
      "type": "rate_reset",
      "dates": {
        "effective_date": "2026-06-01",
        "period_start": "2026-06-01",
        "period_end": "2026-07-22",
        "payment_due_date": null,
        "rate_set_date": "2026-05-18"
      },
      "economics": {
        "base_rate_index": "Daily Simple SOFR",
        "base_rate": 0.02354,
        "margin": 0.036745,
        "all_in_rate": 0.060285,
        "day_count_convention": "Actual/360",
        "days_in_period": null,
        "outstanding_principal_before": null,
        "principal_amount": null,
        "outstanding_principal_after": null,
        "accrued_interest": null,
        "fee_amount": null,
        "fee_type": null,
        "drawdown_amount": null,
        "commitment_reduction_amount": null,
        "unfunded_commitment": null,
        "lender_share_amount": null,
        "global_amount": null
      },
      "warnings": []
    }
  ],
  "field_confidence": {},
  "warnings": []
}